{
  "id": "ikea_micke_drawer_white",
  "type": "drawer",
  "name": "MICKE Drawer, white",
  "brand": "ikea",
  "origin": null,
  "inner_size_mm": null,
  "inner_size_in": null,
  "outer_size_mm": null,
  "outer_size_in": null,
  "visibility": [
    "component"
  ],
  "materials": null,
  "features": null,
  "parts": null,
  "referenced_by_count": 1,
  "added_by": "gh:schieska",
  "status": null,
  "accuracy": null,
  "identifiers": null
}