{
  "id": "ikea_alex_drawer_unit_castors_white",
  "type": "furniture",
  "name": "ALEX Drawer unit on castors, white",
  "brand": "ikea",
  "origin": null,
  "description": null,
  "translations": null,
  "inner_size_mm": null,
  "inner_size_in": null,
  "outer_size_mm": {
    "x": 670,
    "y": 480,
    "z": 660
  },
  "outer_size_in": {
    "x": 26.378,
    "y": 18.898,
    "z": 25.984
  },
  "visibility": [
    "product",
    "standalone"
  ],
  "materials": null,
  "features": null,
  "parts": [
    {
      "ref": "ikea_alex_drawer_castors_white",
      "qty": 3
    }
  ],
  "sources": [
    {
      "kind": "manufacturer",
      "url": "https://www.ikea.com/nl/en/p/alex-drawer-unit-on-castors-white-80485423/"
    }
  ],
  "measurements": [
    {
      "by": "gh:schieska",
      "type": "initial",
      "method": "manufacturer-spec",
      "tool": "unknown",
      "date": "2026-02-06"
    }
  ],
  "tolerance_mm": null,
  "referenced_by_count": 0,
  "added_by": "gh:schieska",
  "status": null,
  "accuracy": null,
  "identifiers": {
    "mpn": [
      "804.854.23"
    ]
  },
  "variant_of": null,
  "variant": null,
  "images": [
    {
      "kind": "product",
      "url": "https://www.ikea.com/nl/en/images/products/alex-drawer-unit-on-castors-white__0977785_pe813769_s5.jpg"
    }
  ],
  "deprecated": null,
  "replaced_by": null,
  "updated_at": null
}