{
  "id": "ikea_micke_drawer_unit_white",
  "type": "furniture",
  "name": "MICKE Drawer unit on castors, white",
  "brand": "ikea",
  "origin": null,
  "inner_size_mm": null,
  "inner_size_in": null,
  "outer_size_mm": {
    "x": 350,
    "y": 500,
    "z": 750
  },
  "outer_size_in": {
    "x": 13.78,
    "y": 19.685,
    "z": 29.528
  },
  "visibility": [
    "product",
    "standalone"
  ],
  "materials": null,
  "features": null,
  "parts": [
    {
      "ref": "ikea_micke_drawer_white",
      "qty": 4
    }
  ],
  "referenced_by_count": 0,
  "added_by": "gh:schieska",
  "status": null,
  "accuracy": null,
  "identifiers": {
    "mpn": [
      "902.130.78"
    ]
  }
}