{
  "id": "ikea_alex_drawer_large_white",
  "type": "drawer",
  "name": "ALEX Drawer (Large), white",
  "brand": "ikea",
  "origin": null,
  "inner_size_mm": {
    "x": 292,
    "y": 520,
    "z": 146
  },
  "inner_size_in": {
    "x": 11.496,
    "y": 20.472,
    "z": 5.748
  },
  "outer_size_mm": {
    "x": 315,
    "y": 540,
    "z": 190
  },
  "outer_size_in": {
    "x": 12.402,
    "y": 21.26,
    "z": 7.48
  },
  "visibility": [
    "standalone",
    "component"
  ],
  "materials": null,
  "features": null,
  "parts": null,
  "referenced_by_count": 1,
  "added_by": null,
  "status": null,
  "accuracy": null,
  "identifiers": {}
}