{
  "id": "ikea_alex_storage_unit_white",
  "type": "furniture",
  "name": "ALEX Storage unit, white",
  "brand": "ikea",
  "origin": null,
  "description": null,
  "translations": null,
  "inner_size_mm": {
    "x": 312,
    "y": 560,
    "z": 644
  },
  "inner_size_in": {
    "x": 12.283,
    "y": 22.047,
    "z": 25.354
  },
  "outer_size_mm": {
    "x": 360,
    "y": 580,
    "z": 700
  },
  "outer_size_in": {
    "x": 14.173,
    "y": 22.835,
    "z": 27.559
  },
  "visibility": [
    "product",
    "standalone"
  ],
  "materials": null,
  "features": null,
  "parts": [
    {
      "ref": "ikea_alex_storage_shelf_white",
      "qty": 1
    }
  ],
  "sources": [
    {
      "kind": "manufacturer",
      "url": "https://www.ikea.com/nl/en/p/alex-storage-unit-white-50563752/"
    }
  ],
  "measurements": [
    {
      "by": "gh:schieska",
      "type": "initial",
      "method": "manufacturer-spec",
      "tool": "unknown",
      "date": "2026-02-06"
    }
  ],
  "tolerance_mm": null,
  "referenced_by_count": 0,
  "added_by": "gh:schieska",
  "status": null,
  "accuracy": null,
  "identifiers": {
    "mpn": [
      "505.637.52"
    ]
  },
  "variant_of": null,
  "variant": null,
  "images": [
    {
      "kind": "product",
      "url": "https://www.ikea.com/nl/en/images/products/alex-storage-unit-white__1209817_pe909458_s5.jpg"
    }
  ],
  "deprecated": null,
  "replaced_by": null,
  "updated_at": null
}